company_name,rate,city,state,remote_work,job_title,salary_estimate,company_size,company_type,company_sector,company_founded,company_industry,job_age,pros,cons,title,position,per_hour,avg_salary,desc,company_size_number
Volga Partners,,,,1,Entry Level Data Analyst for Indonesian Language,Employer Provided Salary,,,,,,7d,,,data analyst,developer,1,27.0,"Job Title: Entry Level Data Analyst for Indonesian Language Hiring language auditors for the following languages: Indonesian Volga Partners is currently hiring for candidates for Data Analyst role! ""Rate: $15.00/hour If applicable Volga Partners follows all state and citys minimum wage requirements in respective city and/or state of applicant."" Job Brief: Responsibilities and Duties: Flexibility to respond and react to changing priorities quickly and efficiently highly organized with attention to detail and a commitment to quality Being able to track and analyze. Regularly working on different kinds of tools which include UHRS. Focusing on the task at hand and most importantly should have sharp cognitive skills. Key Skills: Good oral and written communication language skills and cultural awareness of the target locale ability to understand and prioritize tasks. The ideal person should also be fluent in spoken English and also understand how people talk commonly in the workplace at home and in the street and also have good writing skills. Required Experience and Qualifications: EXPERTISE (Reading writing and/or speaking) in both English and respective second language. Associate degree/ certification in IT/ Communication/Research in similar fields (Preferred but not required.) Excellent computer skills especially typing and written. Attention to detail. Multilingual may be preferred or required. Desire to be proactive and create a positive experience for others. Work Authorization: Must have valid work authorization to work in United States. Background Check: Background checks are mandatory for this position. Currently hiring candidates in the following states: AZ - Arizona CA - California FL - Florida HI - Hawaii IL - Illinois MA - Massachusetts MI - Michigan MN - Minnesota NJ - New Jersey NY - New York NV - Nevada OH - Ohio OR - Oregon PA - Pennsylvania TX - Texas UT - Utah VA - Virginia WA - Washington Please read requirement thoroughly before applying: Job Types: Full-time Part-time Pay: $15.00 per hour Benefits: Schedule: Application Question(s): Education: Work Location: RemoteData analyst play a vital role in researching information for various entities tools and data provided during the on-job training. Candidate should possess good logical and analytical skills to judge the data and give the reasoning. Interprets data and turns it into information which can offer ways to improve a business Take batches of data to label and manipulate according to the project requirements with sufficient level of accuracy Own the quality of all training data and work on proactively identifying issues Work closely with Data Science and Product team on multiple projects to present data quality metrics & identifying new attributes Must have own device (laptop/device). Currently hiring for part-time position but likely to become full-time. For part time position must be available to work minimum between 10am-2pm Pacific Standard Time Monday through Friday (4 hours a day). Must be flexible with training hours for the first few weeks. For full time position must be available to work between 9am-5pm Pacific Standard Time. Must be flexible with hours. For this position we are seeking candidates with flexibility to work between 80-160 hours a month. Ideally candidates with availability to work at least 4 hours a day (Pacific Standard Time Zone) but varies depending on projects. Experience with UHRS platform is a plus! Paid time off Day shift Monday to Friday Do you have UHRS experience? If so how many years? This is a part time position and the hours varies between 15-20 hours a week. Is this something you are still interested in? What is your proficiency level in Indonesian (Reading writing or speaking)? ""Bachelors (Preferred)""",25
University of Utah,4.3,Salt Lake City,UT,0,Business Data Analyst,Employer Provided Salary,10000+ Employees,College / University,Education,1850,Colleges & Universities,11d,Good benefits and that\s it. (in 11 reviews) Working on a campus personal and professional development (in 4 reviews) Smart colleagues (in 3 reviews),Being public the pay may be a bit lower but the benefits make up for it. (in 11 reviews) Base salary on the low side (in 6 reviews) Colleagues who have been around too long or are not motivated (in 3 reviews) Principle Investigators (PI\s) are not evaluated or valued for their management skills (in 3 reviews),data analyst,developer,0,77.5,Provides analysis gathered from SQL queries related to business operations productivity performance planning work methods and procedures. Proactively provides analysis of revenue cycle operations and governmental programs. Provides feedback for strategic planning and business improvement. Responsible for overseeing the analytical needs for various governmental audits. Utilize Business Intelligence tools to identify trends and possible outliers. Design forms tables graphs and charts to summarize gathered information. Prepare for and attend meetings with internal and external stakeholders to assist with understanding data and new regulations to improve business outcomes and protect revenue. Conducts productivity analyses and surveys to improve systems and identify redundant processes. Analyzes new program plans goals and objectives. Assists in the preparation and evaluation of special projects. A Bachelor’s degree in analytics data science statistics or related field and 2-4 years of experience in healthcare. A Master’s degree in a related field. Experience with Tableau R Python and/or SQL. An understanding of Federal Regulatory Programs such as Meaningful Use MIPS and/or value based models. Familiarity of financial practices and regulatory requirements.,10000
"Universal Logistics Holdings, Inc.",3.1,Tempe,AZ,0,"Data Analyst - $2,500 Sign-On Bonus",Employer Provided Salary,1001 to 5000 Employees,Company - Public,Transportation & Logistics,1932,Logistics & Supply Chain,19d,The pay was decent for my position and duties. (in 32 reviews) They have fairly good benefits. (in 28 reviews) Welcoming and caring management (in 18 reviews) Good people to work with (in 20 reviews) Consistent hours pay and work load. (in 21 reviews),Low pay and very little training for the seriousness of the type of documents you’re dealing with. (in 32 reviews) Awful benefits. (in 28 reviews) Poor management and little to no help when you need it. (in 18 reviews) Long hours but fulfilling times (in 21 reviews),data analyst,developer,0,75.0,"Job description ""Universal Logistics Holdings Inc. (ULH) is a leading asset-light provider of customized transportation and logistics solutions. We provide our customers with supply chain solutions that can be scaled to meet your changing demands and volumes. We offer a comprehensive suite of services including transportation value-added intermodal and specialized services that can be utilized throughout your entire supply chain. Universals experienced management team with its state-of-the-art technology provides customized logistics solutions to its customers resulting in proven efficiencies and savings."" Currently Universal is seeking Data Analyst candidates for our Tempe AZ warehouse operation. This operation will support an automotive manufacturer. We manage and operate a warehouse which encompasses; Inventory Management Pick and Pack as well as Just-in-Time shipments. The ideal candidate should possess the following: Responsibilities will include but not be limited to: We offer a competitive base wages and benefits package including major medical dental 401K and vacation in addition to offering upward mobility within the company. If you are an energetic self-motivated individual with the drive to become part of a growing organization do not hesitate respond today! Job Type: Full-time Pay: $70000.00 - $80000.00 per year Benefits: Schedule: Ability to commute/relocate: Experience: Work Location: One location2+ years of experience as a B.I. Analyst or Data Analyst operations background preferred ""Degree in Business Analytics or related field of study - Bachelors degree with significant experience in data science"" Highly proficient in SQL and Tableau dashboard development Experience in developing reports and dashboards in Salesforce is a plus Ability to use Python (or other tools) for data extraction develop ETL pipelines and perform ad-hoc analytics Knowledgeable in using collaboration tools (Git repositories JIRA systems version control etc.) Excellent written and verbal communication skills Developing KPI metrics for the teams – gathering requirements documenting identifying and extracting data and developing solutions Work with business process owners to develop process & data flows to streamline business processes Developing ad-hoc data and reporting solutions – extract data from multiple sources using automated scripts and generate reports/dashboards Presenting and communicating business impacts based on your analysis Collaborate and communicate best practices in data science with other analysts (e.g. code reviews data integrity and reliability) 401(k) Dental insurance Health insurance Life insurance Paid time off Tuition reimbursement Vision insurance 10 hour shift Tempe AZ 85282: Reliably commute or planning to relocate before starting work (Preferred) SQL: 1 year (Preferred)",3000
Institute for Defense Analyses,4.1,Alexandria,VA,0,2022 Data Science Fellowship,Glassdoor est,1001 to 5000 Employees,Nonprofit Organization,Government,1956,Federal Agencies,5d,Excellent benefits— 11% 401k matching (in 9 reviews) Smart and collegial colleagues and good work life balance. (in 5 reviews) Excellent work/life balance. (in 2 reviews) job security pleasant place to work (in 8 reviews),Advancement and raises are opaque— you may not even know what level of employee you are at (in 5 reviews),data science,fellowship,0,91.5,"Effective October 11 2021 all current and newly hired IDA employees must be fully vaccinated against COVID-19 unless they have been granted a medical or religious exemption. Individuals who accept employment with IDA will be required to provide proof that they are fully vaccinated or receive approval for a medical or religious accommodation prior to starting employment. Overview The Institute for Defense Analyses (IDA) is a not-for-profit corporation that operates three Federally Funded Research Centers (FFRDCs). IDA’s Systems and Analyses Center is located in Alexandria Virginia and is comprised of eight research divisions providing objective analyses of national security issues particularly those requiring scientific and technical expertise and conducts related research on other national challenges. The IDA Data Science Fellowship provides recent graduates a unique opportunity to develop and apply data science skills to important issues in national security. Data Science Fellows will investigate the ways machine learning artificial intelligence statistics and big data methodologies contribute to national security and gain experience developing advanced data science tools They will use their critical thinking and analytic skills to work on challenging real-world national security issues. In a collaborative team environment Fellows perform data manipulation and statistical econometric predictive descriptive and other quantitative analyses to answer national security-related research questions. Fellows should expect to learn while creatively contributing to interdisciplinary project teams. Fellows will have an opportunity to work research questions in areas such as: Over the course of the three-year program fellowship experiences will include: Qualifications This is a full time position and is only open to recent recipients of a bachelor’s or master’s degree. Candidates with degrees higher than a master’s degree will not be considered. Candidate with recent Bachelor’s degree or Masters’ degree in economics statistics operations research mathematics physics computer science data science or related disciplines with a strong foundation in statistics and/or applied mathematics are encouraged to apply. Candidates must demonstrate experience with one or more programming language or statistical software used in research (e.g. Python R Julia Stata MATLAB C Java etc.) Candidates must demonstrate strong written and oral communication skills. Ideal candidates are able to contribute to and support team efforts. Additional preferred skills include: U.S. citizenship is required Successful completion of a criminal background check is required Candidates that are selected for employment are expected to start employment between May and July 2022. In addition to the application applicants at later stages in the process will be required to submit the following documents: Personal Statement— explain in 1000 words or less why you want to work in the area of data science and analytics in defense and national security and how your background/experience will contribute to IDA’s work Writing Sample—5000 word maximum Transcripts - unofficial transcript is acceptable for consideration but an official transcript is needed before any offer of employment will be made Two Letters of Academic Recommendation—letters must be signed by the individual rendering the reference and delivered as PDF files. U.S. Citizenship is required Ability to obtain and maintain a security clearance is required ""IDA is an equal opportunity employer committed to providing a fair recruiting process and working environment free from discrimination. All qualified applicants will receive consideration for employment without regard to race color religion sex sexual orientation gender identify national origin disability or protected veteran status. Click here to learn more about IDAs commitment to diversity equity and inclusion.""Appraisal of current DoD investments in a broad range of areas: from human factors to autonomous systems from materials science to nuclear weapons effects from social behaviors to quantum computing; Analyze and research questions on DoD personnel military readiness and efficacy and organizational efficiency topics. Assessment of federal agency information and computing architectures that support data science applications (i.e. large distributed data sets and computational assets); Application of data exploration text analytics forecasting statistical inference simulation to areas of military personnel manpower and acquisition of DOD weapon systems. Involvement in workshops and discussions on relevant topics Mentorship from members of the IDA research staff Training on specific analytical methods and tools Attendance and presentation at select professional society meetings This is a full time position and is only open to recent recipients of a bachelor’s or master’s degree. Candidates with degrees higher than a master’s degree will not be considered. Candidate with recent Bachelor’s degree or Masters’ degree in economics statistics operations research mathematics physics computer science data science or related disciplines with a strong foundation in statistics and/or applied mathematics are encouraged to apply. Candidates must demonstrate experience with one or more programming language or statistical software used in research (e.g. Python R Julia Stata MATLAB C Java etc.) Candidates must demonstrate strong written and oral communication skills. Ideal candidates are able to contribute to and support team efforts. Additional preferred skills include:\nTraining and/or experience in quantitative or qualitative information collection data normalization and text analytics\nExperience as a research assistant in an academic or policy research setting\nExperience or coursework in Bayesian statistics machine learning predictive analytics and/or geospatial analyses\nExperience with GPU high-throughput and/or distributed computing Training and/or experience in quantitative or qualitative information collection data normalization and text analytics Experience as a research assistant in an academic or policy research setting Experience or coursework in Bayesian statistics machine learning predictive analytics and/or geospatial analyses Experience with GPU high-throughput and/or distributed computing U.S. citizenship is required Successful completion of a criminal background check is required Candidates that are selected for employment are expected to start employment between May and July 2022. Personal Statement— explain in 1000 words or less why you want to work in the area of data science and analytics in defense and national security and how your background/experience will contribute to IDA’s work Writing Sample—5000 word maximum Transcripts - unofficial transcript is acceptable for consideration but an official transcript is needed before any offer of employment will be made Two Letters of Academic Recommendation—letters must be signed by the individual rendering the reference and delivered as PDF files.",3000
B4CORP,5.0,Reston,VA,0,"2022510 Data Scientist $215,000.00",Employer Provided Salary,51 to 200 Employees,IT Services,Unknown / Non-Applicable,Company - Private,Information Technology,1d,Great Pay and benefits. (in 2 reviews) Great pay and benefits. (in 1 reviews) The benefits are top notch management is helpful attentive and truly cares about the employees. (in 1 reviews),Everyone is scattered across different skill sets (in 2 reviews),data scientist,developer,0,215.0,Position Requires a Top Secret (TS/SCI) Clearance with a Polygraph. This role uses Data Science and engineering techniques to satisfy customer requirements. This role evaluates and uses algorithms for Natural Language Process (NLP) Artificial Intelligence (AI) and Machine Learning (ML). This role uses large data sets to perform entity resolution and extraction for work products and creates models to test the effectiveness of different courses of action. This role collaborates across a team of Data Scientists Data Administrators and Data Engineers to produce work products.\nExperience with both ElasticSearch and JanusGraph is preferred.\nThis position is on the DataLake Services team – can may involve some unclass work\nFSP is required Estimated Salary:\nPosition Level: Level 1 – Subject Matter Expert\nSalary Range: Up to $215000.00 per year B4Corp Estimated Salary Ranges:\nPosition Level Min Salary Max Salary\nLevel 1 – Subject Matter Expert $160000 $215000\nLevel 2 – Expert $140000 $195000\nLevel 3 – Senior $110000 $170000\nLevel 4 – Full Performance $60000 $100000 Mandatory Requirements: Optional Requirements: B4CORP Company Information B4Corp is a small defense contracting company that focuses on providing an optimum environment for mission-focused highly-skilled consultants to support the United States of America’s intelligence community and other defense organizations. B4Corp provides a low overhead highly efficient high salary environment that allows employees to excel at meeting the client’s needs. B4Corp is looking for information technology professionals that have a high sense of personal responsibility self-motivation and mission drive. B4Corp’s dedication and care for its employees is reflected in the outstanding compensation and benefits B4Corp provides. Our salaries are second to none. B4Corp’s benefits reflect the company’s policy of putting the employees first. Our health insurance demonstrates this with 100% employer coverage and providing employees with a plan that has $0 copay 0% coinsurance and an HSA that can allow employees to accrue health savings for the future. B4Corp’s maximum flexibility comp / makeup time policy along with the company’s cafeteria-style benefit plan that allows employees to maximize their benefit dollars reflects B4Corp’s commitment to its employees. Compensation: Retirement: Insurance 100% Employer-Paid Premiums: Employee Referral Bonus: Paid Time Off (PTO): Tuition and Training: Internal Tracking -RBD-42Outstanding Salaries Full Vanguard 401k Plan – Featuring a full scope of investment options\n– 100% employer matched contribution up to 6% of employee’s salary\n– Ability to max out 401k savings $57k ($63.5k if over 50) Employees receive B4Corp phantom stock each year (2-year vesting period) United Health Care Choice Plus HSA POS Gold 1500 w/HSA\n– Employer funded HSA to cover 100% health care deductible\n– Health insurance: $0 copay $0 co-insurance. Full scope protection for you and your family!\n– 100% employer premium coverage for single and family Health Equity HSA – B4Corp contributes $1500.00 for single and $3000.00 for family into your Health Equity HSA to cover 100% of your health care deductible. Mutual of Omaha Dental VSP Vision Insurance Mutual of Omaha short-term disability (60% of salary up to $2000.00/week) Mutual of Omaha long-term disability (60% of salary up to $10000.00/month) Mutual of Omaha life insurance ($200000.00) Refer a friend or a coworker and receive $3000 per year for every year the person works for B4CORP Seven weeks of leave per year (including ten federal holidays) Ability to purchase 2 additional weeks of vacation Flexible work schedule with comp time (with customer approval) Free CBTNuggets Online Training Account\n– More than 200 online IT courses on a large variety of topics including networking security virtualization and the cloud — from trusted vendors such as Cisco Microsoft and Google.\n– Train anytime anywhere and on a variety of devices – even offline!\n– Transcender® Practice Exams\n– Virtual Labs Free L inux Academy Online Training Account,100
"Vint Hill Solutions, LLC",,Vienna,VA,0,"Analyst, Data Analytics and Visualization",Employer Provided Salary,,,,,,24h,,,,developer,0,65.0,"Imagine what you could accomplish in Vint Hill’s Data Innovation and Insights Group. At Vint Hill thinking outside the box and presenting new ideas have a way of influencing how our clients do business better. Bring passion and dedication to your job always challenge the status quo and there’s no telling what you can accomplish here. The Data Innovation and Insights Group is seeking a Data Analytics and Visualization Analyst to help design and build innovative and scalable reporting and rapid business intelligence solutions; applications; and analytical tools and UI that support our clients’ internal data analytics processes and support executive teams through the delivery of data-driven insights that inform strategic decision making and policy decisions. Key Qualifications & Experience What to Expect Day-to-Day The Data Analytics and Visualization Analyst will be focused on translating statistical data in ways that are optimized for our client’s senior executive teams spanning multiple organizations. This role will be responsible for turning complex disparate data and data sets into clear insightful information through visual displays leveraging a deep understanding of the fundamental principles of information design user interaction and visual best practices that resonate with executive leaders. This role will also understand the underlying data structures and data processes; and have a drive for delivering high-performance high-quality solutions on big data. We are looking for someone who can interpret requirements make informed decisions and collaborate to deliver high-quality finished products and knows when and how to leverage proven design patterns standards and guidelines. Additionally this role will work within the Data Innovation and Insights Group across data engineering applied analytics and data scientists to design and implement new innovative data and business processes to facilitate more efficient data collection analysis reporting and visualization solutions for clients. Education Undergraduate or Master’s degree in one of the following majors with relevant analytics or data management focused coursework desired: Job Type: Full-time Pay: From $65000.00 per year Benefits: Schedule: Supplemental Pay: Ability to commute/relocate: Education: Experience: Work Location: One location2+ years of relevant experience implementing large projects using any Data Visualization tools specifically Tableau and/or Qlik Experience in building visualizations and dashboards in Tableau or related Business Intelligence tools Experience in maintaining reporting reviewing the analytics and dashboard functionality Experience in building automation and managing data flow from Neptune Database into Tableau Experience with Amazon Web Services (AWS) web and iOS technologies is a plus Experience working with big data technologies is a plus Experience with data science and machine learning analyses is a plus Able to work effectively on sometimes ambiguous data and constructs within a fast-changing environment tight deadlines and priority changes Proven ability to manage multiple projects at a time Highly motivated and responsible for self-learning US Citizenship is required Technology: Data Analytics Computer Science Management Information Systems Business: Economics Econometrics Quantitative Finance Finance Accounting Business Analytics Math/Engineering: Industrial Engineering Computer Engineering Financial Engineering Math Statistics Actuarial 401(k) 401(k) matching Dental insurance Flexible schedule Health insurance Life insurance Paid time off Professional development assistance Vision insurance Monday to Friday Bonus pay Vienna VA 22182: Reliably commute or planning to relocate before starting work (Preferred) ""Bachelors (Required)"" Tableau: 1 year (Required)",25
