company_name,rate,city,state,remote_work,job_title,salary_estimate,company_size,company_type,company_sector,company_founded,company_industry,job_age,pros,cons,title,position,per_hour,avg_salary,desc,company_size_number
Wayfair,3.4,Boston,MA,0,"Manager, Applied Data Science",Glassdoor est,10000+ Employees,Company - Public,Retail,2002,Home Furniture & Housewares Stores,30d+,time job and the people I met there were smart and (mostly) kind. (in 57 reviews) Great culture and lots of people right out of college to make the transition into a new job easy. (in 52 reviews) Competitive pay (in 41 reviews) Good work life balance and an international environment. (in 25 reviews) Management has been good about encouraging work/life balance. (in 24 reviews),People are also EXTREMELY cliquey here. (in 57 reviews) Culture has become less like that of a startup\s (in 52 reviews) low pay compared to other tech company (in 41 reviews) Work life balance isn\t great. (in 25 reviews) Compensation is below average and management is very messy. (in 24 reviews),data science,manager,0,119.5,"The B2B Insights & Analytics team exists to drive optimal decision-making that improves our business customers’ FF&E shopping experience through Sales interactions. We seek to optimize Sales incrementality by identifying the most CLV-accretive Sales interactions with customers as a critical driver of our flywheel. The data we are experts in represents the voice of external customers (e.g. onsite activity communication with Business accounts orders & firmographic data) and internal customers (e.g. onsite activity communication between Sales representatives & Business accounts CRM and Sales Operations data) - we source interpret and translate that voice into action that serves our customers. This team leads measurement - particularly around causal inference - and also plays a data challenger role to ensure the STO understands the “why” behind great customer experiences. And we partner closely with Data Science - to jointly develop and apply machine learning approaches to drive growth and Data Solutions/Engineering - to ensure we have a strong and high-velocity data foundation.\nApplied Data Science - B2B Sales Incrementality Optimization team exists to identify opportunities and provide actionable recommendations based on hard data to grow revenue and improve efficiency. We strive to deliver better understanding of customers and improve the engagement model between Sales and customers.\nWe expect team members and management to take high degree of ownership for their areas of focus and execute on ideas and deliver results under fast-paced cultures. Beyond a strong academic background a successful candidate will have experience successfully designing and launching A/B testing measuring impact for unbalanced or skewed data sets building models and/or creatively leveraging model outputs to improve the existing Sales program structures or Sales engagement models. We are looking for someone who is a self-starter who approaches complex business questions with data and curiosity who dives below the surface to identify the causal relationship rather than just trends and who works effectively with technical and non-technical cross-functional teams.\nWhat You’ll Do Potential projects you could own: What You’ll Need About Wayfair Inc.\nWayfair is one of the world’s largest online destinations for the home. Whether you work in our global headquarters in Boston or Berlin or in our warehouses or offices throughout the world we’re reinventing the way people shop for their homes. Through our commitment to industry-leading technology and creative problem-solving we are confident that Wayfair will be home to the most rewarding work of your career. If you’re looking for rapid growth constant learning and dynamic challenges then you’ll find that amazing career opportunities are knocking.\nNo matter who you are Wayfair is a place you can call home. We’re a community of innovators risk-takers and trailblazers who celebrate our differences and know that our unique perspectives make us stronger smarter and well-positioned for success. We value and rely on the collective voices of our employees customers community and suppliers to help guide us as we build a better Wayfair – and world – for all. Every voice every perspective matters. That’s why we’re proud to be an equal opportunity employer. We do not discriminate on the basis of race color ethnicity ancestry religion sex national origin sexual orientation age citizenship status marital status disability gender identity gender expression veteran status or genetic information. Job Type: Full-timeOwns the end-to-end roadmap and product development process for work impacting a material piece of a customer experience or customer-facing platform (internal or external): soliciting and prioritizing ideas with stakeholders based on the potential impact for customers and the level of effort required for implementation. Take a leadership role in ensuring we are focused on the most impactful business questions translate into technical requirements and determine the appropriate method to deliver high ROI results. Identify what modeling/analytical approach technique is best suited to answer the questions at hand making appropriate tradeoffs and pivoting as necessary. Use GBQ Python/R & Looker to wrangle Wayfair’s unique data to develop hypotheses experiments and analyses that point to the most significant business growth opportunities. Identify the relevant software/technology and build scalable tools that can be used as the foundation for others. Able to incorporate more advanced design elements into visualization/databoards. ""Proactively contribute to developing the organizations talent & management (either direct reports or indirectly through cross-functional or project work): do so by offering timely feedback on work product offer career development advice or contribute to workstreams to improve talent development within their team/function/etc."" Work closely with Sales Program Management Sales Operations Marketing Data Solutions Data Science Category Management Finance Pricing and other teams to develop and execute analyses and tests that lead to accelerating growth. Communicate findings and recommendations with relevant teams and leadership to drive measurable improvements in Sales incrementality. Data Driven Coaching: enhance the coaching efforts of BAM managers so coaching sessions are more efficient and agent performance on our KPIs improves (e.g. identify which agent behaviors/sales skills most influence our KPIs leveraging NLP and topic modeling outputs). Identify Influenceable Customers: identify high potential influenceable customers from the huge self-service customer pool and drive incremental revenue by providing those customers with personalized Sales treatment. Sales Incrementality Recommendations: provided actionable recommendations to Sales Training Sales Operations and Program Management based on program-level A/B testing to maximize sales incrementality and profitability. Masters Degree in machine learning statistics mathematics or another quantitative field with 4+ years (or PhD with 2+ years) of experience working within an analytical role. Hands on experience with experiment design implementation and analysis (A/B tests holdout tests etc.). Hands on experience with statistical and ML modeling (NLP customer segmentation predictive modeling) to solve complex business problems. Hands on experience working with incomplete and dirty datasets and being involved with improving them in a meaningful way. Proven track record in leading and executing on analytical projects including experience in defining vision and getting buy-in from technical teams and business stakeholders across the organization. Excellent verbal and written communication and presentation skills ability to convey rigorous mathematical concepts to non-experts. A passion for analytical work with a high bar for zero defect analysis. 4+ years of SQL and Python (or R) experience as well as the understanding of query optimization. Ability to prioritize projects with a focus on business impact.",10000
Liberty Mutual Insurance,3.8,,,1,"Director I, Data Science",Employer Provided Salary,10000+ Employees,Company - Private,Insurance,1912,Insurance Carriers,24h,Flexibility and good work life balance (in 27 reviews) 2. Pay is good (in 20 reviews) good benefits (in 12 reviews) care very much about employees (in 16 reviews) Great management (in 8 reviews),Not much if you like great work life balance (in 27 reviews) Management was overbearing at times and often promoted previous adjusters (in 8 reviews),data science,developer,0,158.5,"Design and fine tune language models (NLP/NLU) to understand and build predictions or summaries from customer calls claim notes web chats medical records and beyond Detect property hazards from aerial imagery damage from customer photos find and read a number in a scanned document etc. using computer vision (CV) Collaborate with technology partners to adopt design build and/or integrate MLOps tools for the organization ensuring they support broad DS needs and help other DS groups adopt modern MLOps practices ""Explore the advantages and limitations of privacy-preserving ML and synthetic data to accelerate experimentation and better protect our customers data"" Engage in theoretical research in collaboration with top tier academic institution (link) to shape the future of AI Broad knowledge of machine learning and statistics with the ability to deep dive as well as converse at the executive level. NLP/NLU and other deep learning experience a strong plus. Advanced python and related programming skills Experience directing or managing small to medium projects Ability to give effective training and presentations to DS management and other groups Established ability to supervise mentor and/or manage junior data scientists Advanced degree and 5 to 7 years of relevant experience or a Bachelor`s degree with 10 years of relevant experience",10000
TEKsystems,,Bellevue,WA,0,Digital Data Analyst,Employer Provided Salary,1001 to 5000 Employees,Subsidiary or Business Segment,Business Services,1983,Staffing & Outsourcing,3d,Decent pay work in team environment (in 28 reviews) Helpful Management (in 23 reviews) TEKsystems had a great culture. (in 18 reviews) very much employee friendly and transparent protocols. (in 25 reviews) Benefits are decent (in 16 reviews),Maybe the pay is a bit low but the opportunities with respective clients is paramount. (in 28 reviews) except there were no benefits while I was on contract but I knew that going into this! (in 16 reviews),data analyst,developer,1,90.0,"Description: TEKsystems is looking for an experienced Data Analyst to join their Digital Business Analytics teams supporting multiple lines of business. TEKsystems Digital is standing up their own ""digital first"" data architecture that will house all raw data relevant to digital and marketing efforts. The Digital Business Analytics team is responsible for turning this raw data into actionable reports and insights for all digital lines of business. This team is broken down into three core functions data analysis (decision science) data engineering and reporting. The data analyst works hand and glove with the leaders of each line of business to help them identify areas that can be driven by actionable insights help them better understand their business and enable them to analyze and optimize their business. These roles will support the Beyond the Smartphone (emerging products) Post-paid pre-paid and TEKsystems for Business lines of business working to answer the question ""what are the mechanisms that make a customer want to interact online with us and what\s the most efficient way to get there?"". TEKsystems is looking for team members that are experienced within their discipline that can operate independently with minimal hand holding can drive results in an ambiguous and adapting environment and provide a consultative dialogue with cross-functional teams to provide recommendations based off of their expertise. Role Overview Responsibilities Communication skills and stakeholder management. Minimum Qualifications Preferred Qualifications Skills: Sql Adobe Suite Data analysis Tableau Business analysis Additional Skills & Qualifications: Experience Level: Intermediate Level ""Were partners in transformation. We help clients activate ideas and solutions to take advantage of a new world of opportunity. We are a team of 80000 strong working with over 6000 clients including 80% of the Fortune 500 across North America Europe and Asia. As an industry leader in Full-Stack Technology Services Talent Services and real-world application we work with progressive leaders to drive change. Thats the power of true partnership. TEKsystems is an Allegis Group company."" The company is an equal opportunity employer and will consider all applications without regards to race sex age color religion national origin veteran status disability sexual orientation gender identity genetic information or any characteristic protected by law.Seeking a talented analytics professional who thrives at the intersection of data purchase behavior marketing product and engineering. The ideal candidate will have a strong technical and analytical background as well as an intense hunger to make a significant business impact by owning and driving business outcomes. Strong time management and communication skills are critical. Experience finding and manipulating data to build data sets with Adobe Partner with marketing research and product organizations to scope design execute measure and improve the impact of digital product development and marketing efforts of the business Translate data insights into actions and recommendations that will drive user growth and engagement while improving marketing effectiveness Experience translating quantitative findings into actionable insights and influence business decisions This role will work cross-functionally with marketing product data engineering and research teams to provide insightful analytics and make business recommendations. At least 4 years of hands-on experience with Adobe suite (e.g. Adobe Analytics Adobe Experience Platform etc.) 4 years of experience with data analysis data science decision science or similar quantitative fields A degree in economics operations research mathematics statistics engineering psychology or another field with quantitative roots and demands 3-6+ years of experience with hands-on data analysis data science decision science or similar quantitative fields applying experimentation methods to test various hypotheses for customer segmentation user growth and outbound marketing campaign evaluation ""An MBA or Masters degree in economics operational research mathematics statistics engineering psychology or another field with strong quantitative roots and demands"" Management consulting experience or a similar career requiring one to present data-driven insights to business audiences 3-6+ years of experience with hands-on data analysis data science decision science or similar quantitative fields applying experimentation methods to test various hypotheses for customer segmentation user growth and outbound marketing campaign evaluation ""An MBA or Masters degree in economics operational research mathematics statistics engineering psychology or another field with strong quantitative roots and demands"" Management consulting experience or a similar career requiring one to present data-driven insights to business audiences",3000
CorTech,3.8,New York,NY,0,Data Engineer,Employer Provided Salary,201 to 500 Employees,Company - Private,Business Services,1999,Staffing & Outsourcing,24h,Satisfactory rates responsive account managers (in 2 reviews),Difficult sometimes to communicate since only the account manager handles everything might take a while to accomplish requests (in 2 reviews),,developer,1,112.5,,350
NIKE INC,4.1,Mulino,OR,0,"Senior Director, Digital Experience Data Science",Glassdoor est,10000+ Employees,Company - Public,Manufacturing,1972,Consumer Products Manufacturing,24h,There are endless opportunities and they spend a lot of time training leadership which I really appreciated. (in 13 reviews) great benefits (in 14 reviews) amazing people (in 18 reviews) Great brand leadership and culture. (in 15 reviews) Transportation work life balance good (in 14 reviews),there is a lack of advancement opportunity (in 13 reviews),data science,senior,0,140.0,Become a Part of the NIKE Inc. Team NIKE Inc. does more than outfit the world’s best athletes. It is a place to explore potential obliterate boundaries and push out the edges of what can be. The company looks for people who can grow think dream and create. Its culture thrives by embracing diversity and rewarding imagination. The brand seeks achievers leaders and visionaries. At NIKE Inc. it’s about each person bringing skills and passion to a challenging and constantly evolving game. WHO ARE WE LOOKING FOR We are looking for a seasoned data science leader for our Digital Experiences Data Science team. The Senior Director of Digital Experiences role will be responsible for leading the data science teams that work on optimizing and personalizing Nike’s digital experiences. These experiences include both Nike.com and on the Nike app in the United States China Europe and elsewhere around the globe as well as Nike’s SNKRS and WeChat apps. Today this body of work is focused on using machine learning for search relevance and product recommendations. The aim is to leverage data science more broadly across these digital platforms. WHAT WILL YOU WORK ON You will… WHO WILL YOU WORK WITH You will be the leader of the Digital Experiences Data Science team reporting to the Vice President of Consumer Data Science. Digital Experiences Data Science is part of Nike’s Consumer Data Science sub-function and Insights and Analytics function. So you will be a member of the broader data science and analytics community at Nike and help organize and participate in our data science labs study groups and team activities and attend conferences. WHAT YOU BRING NIKE Inc. is a growth company that looks for team members to grow with it. Nike offers a generous total rewards package casual work environment a diverse and inclusive culture and an electric atmosphere for professional development. No matter the location or the role every Nike employee shares one galvanizing mission: To bring inspiration and innovation to every athlete* in the world. NIKE Inc. is committed to employing a diverse workforce. Qualified applicants will receive consideration without regard to race color religion sex national origin age sexual orientation gender identity gender expression veteran status or disability.Partner closely with the other data science leaders within Consumer Data Science. This includes aligning Digital Experience Data Science roadmaps with our those of the data science teams working in the areas of sport activity content planning and marketing communications. Reuse data and models where possible. Partner closely with Nike’s Digital Product Management leadership providing input into the overall digital roadmaps and in particular helping to identify and advocate for high leverage uses of data and data science across Nike’s digital experiences. Partner closely with Nike’s Global Technology leadership that works on data engineering platform engineering and experience engineering. Ensure that the foundational data systems and processes are in place to successfully execute on data science. Evaluate the evolving landscape of vendors of data science capabilities for ecommerce and develop a position on which capabilities should be built in house. Lead through leaders including our search and personalization data science leaders and teams that are in place today and who will report into this role. Be an inspirational thought leader within the broader analytics and data science communities at Nike. Hire onboard and mentor talented data scientists and data science leaders. Experience developing strong partnerships with engineering and product teams. Experience managing through senior managers. Experience hiring and mentoring exceptional data scientists. Experience communicating technical roadmaps to business leaders. Experience practicing data science even if not recently. A product and entrepreneurial mindset. Bachelors degree or higher or Combination of relevant education experience and training.,10000
Liberty Mutual Insurance,3.8,,,1,Director of Data Science Engagement and Talent Strategy (remote),Employer Provided Salary,10000+ Employees,Company - Private,Insurance,1912,Insurance Carriers,10d,Flexibility and good work life balance (in 27 reviews) 2. Pay is good (in 20 reviews) good benefits (in 12 reviews) care very much about employees (in 16 reviews) Great management (in 8 reviews),Not much if you like great work life balance (in 27 reviews) Management was overbearing at times and often promoted previous adjusters (in 8 reviews),data science,developer,0,157.0,"""At Liberty Mutual our purpose is to help people embrace today and confidently pursue tomorrow. Thats why we provide an environment focused on openness inclusion trust and respect. Here youll discover our expansive range of roles and a workplace where we aim to help turn your passion into a rewarding profession.\n\nLiberty Mutual has proudly been recognized as a “Great Place to Work” by Great Place to Work® US for the past several years. We were also selected as one of the “100 Best Places to Work in IT” on IDGs Insider Pro and Computerworlds 2020 list. For many years running we have been named by Forbes as one of Americas Best Employers for Women and one of Americas Best Employers for New Graduates—as well as one of Americas Best Employers for Diversity. To learn more about our commitment to diversity and inclusion please visit: https://jobs.libertymutualgroup.com/diversity-inclusion\n\nWe value your hard work integrity and commitment to make things better and we put people first by offering you benefits that support your life and well-being. To learn more about our benefit offerings please visit: https://LMI.co/Benefits\n\nLiberty Mutual is an equal opportunity employer. We will not tolerate discrimination on the basis of race color national origin sex sexual orientation gender identity religion age disability veterans status pregnancy genetic information or on any basis prohibited by federal state or local law.""Design implement and support new and ongoing initiatives that enable the Office of Data Science (ODS) to drive talent and community strategy. Work with data science executives senior managers and Talent experts to craft and implement talent strategy including employee engagement professional development roles & advancement recruitment & talent pipeline compensation and retention. Oversee the creation and implementation of data science development and training programs. Support the Data Science Professional Resource Group (DSPRG) a data science community professional resource group with workstreams dedicated to community building employee engagement talent strategy and improving data science across Liberty. Drive enterprise DS/AI communication targeting data scientists executives and the business. Manage one direct report supporting talent development efforts. Expert-level ability in managing all aspects of the project management life cycle for multiple projects at one time to include those complex in nature. Project management certification strongly preferred. Solid ability to select develop and engage employees. Strong ability to exercise influence and build consensus; communication skills; promote collaboration teamwork and change initiatives; and to build value for customers through a service orientation innovation and continuous improvement. Displays strong business acumen and integrated thinking. ""Advanced business operations knowledge to include understanding the functions value chain and market conditions strongly preferred."" ""Competencies typically acquired through a Bachelors degree or equivalent experience."" Advanced degree preferred. Minimum of 10 years of relevant experience to include project management work and prior experience working in an effective leadership and/or management capacity.",10000
