company_name,rate,city,state,remote_work,job_title,salary_estimate,company_size,company_type,company_sector,company_founded,company_industry,job_age,pros,cons,title,position,per_hour,avg_salary,desc,company_size_number
Making Waves Foundation,,Richmond,CA,0,Data Specialist,Employer Provided Salary,,,,,,6d,,,data specialist,developer,0,87.0,"DATA SPECIALIST JOB DESCRIPTION\nOverview\nJob Title: Data Specialist\nLocation: Richmond CA\nBase Pay: $77000-$97000 commensurate with experience.\nBenefits: Reports to: Aiyana Mourtos Vice President Impact Our History Making Waves Foundation (MWF) is a private operating foundation that supports Making Waves\nAcademy (MWA) a 5-12 grade public charter school serving over 1000 students in Richmond CA and operates CAP a college success program providing a critical bridge between college acceptance and graduation for college students. Committed to advancing educational opportunities for children of color from historically underrepresented and underserved communities we provide students access to opportunity the support they need to succeed and the agency to pursue their chosen postsecondary pathway. We are among the first organizations to focus on both college access and success as a strategy to support underserved and underrepresented students – from 5th grade through early career. Together\nMWA and CAP form a unique holistic educational model that supports students academically socially emotionally and financially on their journey to through and beyond college. Our Strategic Plan Over the next ten years MWF is pursuing an expansion strategy working toward equity and excellence in college attendance and graduation for Contra Costa students. A key lever in strengthening our impact and scaling effectively is implementing focused learning cycles that center the experience of those closest to the challenge we seek to address alongside best practices and qualitative and quantitative data. To effectively implement this structured approach of organizing our work and learning through iterative practice and reflection requires a robust data infrastructure and aligned measurement framework. To that end Making Waves Foundation seeks a Data Specialist to manage our work toward building a strong foundation to ensure data is: The Data Specialist will serve as the organization’s resident data expert and will develop data tools models reports and analyses to support and enhance student programming. This position will have the opportunity to establish best in-kind data practices; perform strategic and ad hoc data analyses to support strategic decision-making; conduct research to inform program design and evaluation; and build capacity for data-driven problem-solving and continuous improvement. Core Competencies\nDo any of the following sound like you? Then this position may be for you! Responsibilities\nThe below statements are intended to describe the general nature and scope of work being performed by this position. Other duties may be assigned as needed. Data Systems and Tools Analysis and Reporting Data Practice Aligned with the core responsibilities above success for this individual in their first 6-12 months will look like: Qualifications Power BI Tableau) and ability to use advanced Excel functionalities (pivot tables lookup procedures for merging data). Making Waves Foundation has implemented a hybrid work model starting in January 2022. Making Waves Foundation is requiring all staff members who work on-site to be fully vaccinated against COVID-19 as defined by the CDC. Accommodations or exceptions can be requested directly to someone on the Talent Team for medical or religious reasons. Making Waves Foundation strives to build a staff that reflects the cultural diversity of the communities that we partner with. Making Waves Foundation provides equal employment opportunities to all employees and applicants for employment and prohibits discrimination and harassment of any type without regard to race color religion age sex national origin disability status genetics protected veteran status sexual orientation gender identity or expression or any other characteristic protected by federal state or local laws. We encourage BIPOC identifying individuals to apply. Application\nInterested candidates are invited to submit their resume and brief responses (300 words max per question) to the questions below. To apply follow the link for the Data Specialist role posted here. 1. Why are you interested in exploring whether the Data Specialist opportunity is the right fit for you and Making Waves Foundation? 2. Describe a time when you cleaned analyzed and presented data-based insights that helped an organization or team achieve an ambitious outcome. Please include context about your role your approach and the tools that you leveraged. 3. What analysis and data visualization tools have you previously used? Job Type: Full-time Pay: $77000.00 - $97000.00 per year Benefits: Schedule: Supplemental Pay: COVID-19 considerations:\nMaking Waves Foundation is requiring all staff members who work on-site to be fully vaccinated against COVID-19 as defined by the CDC. Accommodations or exceptions can be requested for medical and religious reasons. Education: Experience: Work Location: One locationGroup insurance plans with medical dental vision group life insurance and long-term disability plans (100% employer contribution for the employee) Retirement plan including a matching contribution Flexible Spending Account (FSA) for medical/dependent care expenses 24 vacation days 10 sick days and 2 personal days per fiscal year (for full-time employees) 15 paid holidays per fiscal year Training and professional development opportunities A hybrid work environment Aligned: Data reflects the kind of information we care about and that we are going to use. It is aligned with our program strategy and theory of action so that we can discern what is happening if it’s happening as expected and what and how to improve or innovate. Accurate: Data is complete valid and consistent. We implement measurement tools that are accessible and inclusive across lines of difference. We rely on standard documented reporting and analysis practices to ensure data is accurate and represented fairly in our reporting. Actionable: Data is timely and relevant to the end-user. It is presented visually to facilitate interpretation learning and reflection; and it is differentiated by audience and focus to support effective planning and decision-making – all in alignment with our strategic goals. Integrated: Data is understood actively referenced and integrated in day-to-day practice and established organizational planning problem-solving and learning routines. Commitment to Making Waves’ mission: You believe all youth regardless of race ethnicity or socioeconomic status should have access to high-quality educational opportunities Commitment to equity diversity and inclusion: You acknowledge that marginalized communities face systemic inequities. You see the value in and actively seek and create space for diverse perspectives to inform your work and promote fairness for everyone. Knack for numbers: You are proficient in various forms of quantitative analysis and have an exquisite attention to detail. You genuinely enjoy sifting through data to find trends patterns insights. Data detective: You bring an analytical mindset and methodical approach to your work. You are naturally curious and have a high “figure-it-out” quotient to work through problems big and small. Data storyteller: You believe data-driven decision-making is essential for continuous improvement and effective growth; and work to present complex and technical concepts in clear compelling ways through relevant visuals and verbal/written communication. You are fluent in a data visualization tool (e.g. PowerBI Tableau). Develop and maintain organization metrics book to ensure clarity consistency and replicability of data practices and analyses; support ongoing data governance for the foundation. Support in identifying appropriate research-based metrics and benchmarked targets for program goals. Collaborate with IT team to ensure data is stored and transferred between applications securely. Support the design and maintenance of data tools used to monitor and inform program design and implementation. Produce customized dashboards for individuals managers leaders. Prepare data reports and appropriate visualizations. Translate complex analyses into a format that a broader audience can understand and act upon. Locate clean and combine available source data for analytic priorities; troubleshoot anomalies in data; and produce analyses of the data to support program needs. Conduct analysis of available data to identify areas of opportunity and craft concrete recommendations for program improvement. Present data and progress on data-driven initiatives for leaders; communicate progress to key stakeholder groups and incorporate their input. Respond to internal and external data requests and inquiries. Design and deliver data-driven learning experiences for program staff. Build relationships and liaise with various teams to drive collaboration and synergize support by layering in data analysis and requests related to content-specific work. Engage with colleagues and program teams to determine opportunities for improvement research specific issues and develop recommendation plans to resolve. Anticipate identify and resolve complex obstacles to success of overall work responsibilities and specific projects. Building relationships and understanding the team’s work to inform adaptive and technical data support and development; developing a perspective and recommendations on where and how to prioritize realizing the organization’s data vision Supporting the development of a program measurement framework including identification of appropriate measures tools and targets Designing and producing actionable and interactive reports and dashboards for staff – and building staff capacity through aligned learning experiences to support data-driven problem- solving learning and design Codifying and defining standard data collection and reporting practices in a technical metrics book and annual reporting calendar ""Bachelors degree in applied mathematics statistics data science relevant social science or related data-intensive discipline and three to five years of related work experience (or equivalent combination of advanced education and experience) in the field of public or education administration business performance measurement program evaluation data analysis educational research or evaluation or a related field."" Previous exposure to or experience in the education sector a plus. Demonstrated success in using data analysis to inform strategic planning and decision-making applying skills to communicate complex information to a variety of audiences easily and training others in measurement and target-setting. Excellent quantitative skills including the ability to examine available data apply decision rules and analytical methods produce descriptive and inferential statistics and prepare meaningful reports based on analyses that enable programmatic next steps and actions. Fluency in a statistical software package (e.g. Stata SAS or SPSS) data visualization tool (e.g. Strong attention to detail and accuracy of information including the ability to organize large amounts of data and track multiple projects simultaneously setting priorities for analysis and use in consultation with numerous stakeholders. Excellent communication skills including ability to contribute to discussions drawing upon expertise to influence group outcomes. Dental insurance Employee assistance program Flexible schedule Flexible spending account Health insurance Life insurance Paid time off Professional development assistance Retirement plan Vision insurance 8 hour shift Monday to Friday Bonus pay ""Bachelors (Required)"" data analysis: 3 years (Preferred)",25
ASHLIN Management Group,,Bowie,MD,0,Data Analyst,Employer Provided Salary,,,,,,30d+,,,data analyst,developer,0,72.5,"ASHLIN Management Group is seeking a Data Analyst to join our team working with our data analytics team. This professional will start off working with ASHLIN’s cloud-based visualization platform CompassBI powered by Sisense on visualizing descriptive statistics and other key performance indicators and building ASHLIN’s library of dashboard templates. Additional projects will include supporting our team of project specialist in developing deliverables to our clients based research and analysis methods using statistical models on business data collected in field. Candidates should also be comfortable preparing routine as well as ad-hoc business reports and PowerPoint decks to present the information to senior management and clients. Essential duties and responsibilities: · Develop visualizations using tools such as Tableau PowerBI and/or Sisense · Use sophisticated data analysis methods to support project team in creating deliverable for client · Work with clients to devise methods to optimize data capturing schemes and overall program evaluation plan Perform statistical modeling (e.g. ANOVA) using statistical software applications such as R and SPSS · Work with Senior Database Architect(s) to develop analytical SQL queries and reports for tracking trending and interpreting business data · Perform ongoing data quality assessments identify discrepancies/inconsistencies and resolve them · Continually improve the end-to-end process of data collection transformation analysis and reporting · Develop data management programs and forms for data entry and maintenance by end-users · Document data analysis and reporting architecture designs and write user guides · Other duties as defined by senior research team Qualifications To be successful in this position the Data Analyst must have a minimum of 3 years’ experience in: § Data analysis involved in both primary and secondary research using data to arrive at decision pertaining to marketing strategies § Ability to interpret complex data sets (quantitative and qualitative) into insights that lead to effective marketing strategies and frameworks § Strong data analysis modelling specifically the successful candidate must be able to: § Conduct cross-tabular and ANOVA and other statistical analysis using R and/or SPSS § Interpret results of statistical analysis output and draw insights in order to make recommendations to senior management what steps to take § Present data interpretation and resulting strategy in language that indicates a command of the material while at the same time making sense to lay persons who may not have a marketing and/or data analysis background § Develop data reports using the following tools and technologies: § MS-Excel (Pivot Tables VBA Power Pivot H-Lookup V-Lookup Import/Export from/to external data sources) § Online Dashboards (e.g. Tableau PowerBI Sisense) § Expert level skills in the development of highly impactful PowerPoint slide decks § Development of scheduled and ad-hoc reports and analysis. § Working in a team environment with responsibility for delivery of timely and accurate business-critical reports and analysis: § Self-motivated and proactive willing to drive a program of work to successful completion § Strong oral/written communication and presentation skills § Ability to work with highly sensitive information and preserve the confidentiality of the information § Detail oriented and capable of identifying and resolving data quality issues. In addition the following are highly desirable: § A minimum of 3 years’ experience with statistical analysis tools (e.g. R SPSS) § A background in market research or related disciplines § Working knowledge of relational databases (e.g. SQL) Position requirements include: § At least a Bachelor’s Degree in Math Probability & Statistics or related data science field § Master’s degree in any of the above disciplines is highly desirable or MBA § High proficiency with statistical analysis tools § Only open to candidates US Citizens and Permanent Residents currently authorized to work in the US Job Type: Full-time Pay: $65000.00 - $80000.00 per year Benefits: Schedule: Application Question(s): Willingness to travel: Work Location: This Job Is Ideal for Someone Who Is: ""Companys website:"" Benefit Conditions: Work Remotely: COVID-19 Precaution(s): Work Location: One location401(k) 401(k) matching Dental insurance Health insurance Paid time off Vision insurance 8 hour shift How many years of Data visualization do you have? 25% (Preferred) One location Dependable -- more reliable than spontaneous People-oriented -- enjoys interacting with people and working on group projects Adaptable/flexible -- enjoys doing work that requires frequent shifts in direction Detail-oriented -- would rather focus on the details of work than the bigger picture Achievement-oriented -- enjoys taking on challenges even if they might fail Autonomous/Independent -- enjoys working with little direction www.ashlininc.com Waiting period may apply Temporarily due to COVID-19 Remote interview process Virtual meetings",25
Bloomberg,4.1,New York,NY,0,Head of Enterprise Data Science,Glassdoor est,10000+ Employees,Company - Private,Information Technology,1981,Computer Hardware & Software,11d,a good place to retire since benefits are good if your willing to sacrifice salary/growth (in 102 reviews) Great Culture and Open Learning Environment. (in 98 reviews) People are great to talk to and laid back. (in 84 reviews) Resourceful supportive management (in 56 reviews) Good work life balance (in 67 reviews),The promised benefits are also extremely hard to avail. (in 102 reviews) Weird culture flat structure just means power is super concentrated at the top. (in 98 reviews) I was surprised by how low the business acumen of the people here are. (in 84 reviews) micro management can sometimes be difficult to deal with (in 56 reviews) Difficult to maintain good work/life balance (in 67 reviews),data science,head of enterprise,0,154.5,"Manage teams responsible for large and complex analytical projects from data exploration model building performance evaluation and testing leveraging the latest data science techniques Understand financial clients"" quantitative/research use cases and creating compelling solutions that address real client needs Lead discussions with senior client decision makers Advance best practices and provide thought leadership within data science and product teams Continually research and evaluate emerging technologies; stay current on published state-of-the-art methods technologies and applications and seeking out opportunities to apply them 5 years of experience leading Data Science teams solving high impact business problems A Bachelor or Master""s degree in Science Computer Science or related disciplines Experience with diverse technology applications and associated architectures Knowledge of and interest in structured financial data models and data driven requirements Experience working with Global Multidisciplinary Teams (Sales Technology and Operations) Experience with applied statistics and quantitative modelling (e.g. regression survival analysis segmentation experimentation and machine learning when needed) Demonstrated ability to translate analytical insights into clear recommendations and effectively communicate them to technical and non-technical stakeholders including senior management The ability to address multiple priorities in an extremely fast-paced environment Curiosity about the problem domain and an analytical approach Strong focus on outcomes and delivery balanced with a practical and hands-on approach to timely regular incremental delivery of high quality revenue generating products",10000
NIKE INC,4.1,Vancouver,WA,0,"Senior Director, Member Modeling Data Science",Glassdoor est,10000+ Employees,Company - Public,Manufacturing,1972,Consumer Products Manufacturing,24h,There are endless opportunities and they spend a lot of time training leadership which I really appreciated. (in 13 reviews) great benefits (in 14 reviews) amazing people (in 18 reviews) Great brand leadership and culture. (in 15 reviews) Transportation work life balance good (in 14 reviews),there is a lack of advancement opportunity (in 13 reviews),data science,senior,0,154.0,Become a Part of the NIKE Inc. Team NIKE Inc. does more than outfit the world’s best athletes. It is a place to explore potential obliterate boundaries and push out the edges of what can be. The company looks for people who can grow think dream and create. Its culture thrives by embracing diversity and rewarding imagination. The brand seeks achievers leaders and visionaries. At NIKE Inc. it’s about each person bringing skills and passion to a challenging and constantly evolving game. Member Modeling Data Science is part of Nike’s Insights function. So you will also be a member of the broader data science and analytics community at Nike and participate in our data science labs study groups and activities and attend conferences. What you bring NIKE Inc. is a growth company that looks for team members to grow with it. Nike offers a generous total rewards package casual work environment a diverse and inclusive culture and an electric atmosphere for professional development. No matter the location or the role every Nike employee shares one galvanizing mission: To bring inspiration and innovation to every athlete* in the world. NIKE Inc. is committed to employing a diverse workforce. Qualified applicants will receive consideration without regard to race color religion sex national origin age sexual orientation gender identity gender expression veteran status or disability.Lead a talented team of Data Science Directors and Sr Data Scientists. Hire onboard and develop additional data scientists and data science directors. Lead workstreams that require cross-functional squads that include data scientists data engineers analysts and product managers. Manage our portfolio of member model capabilities including lifetime value segmentation fraud and onboarding models. Develop methods and tools that further enrich Nike’s member data while also respecting the privacy of our members. Expand the vision for member modeling at Nike. Learn the business of designing shoes and apparel and bringing them to market around the globe to understand how to best serve stakeholders. Be a part of the broader data science community within Nike and contribute to a culture of learning. Experience hiring and mentoring exceptional data scientists. Experience leading through leaders (directors will report into you). Experience developing strong partnerships with engineering and product teams. Experience communicating technical roadmaps to business leaders. Experience practicing data science. A product and entrepreneurial mindset. Bachelors degree or higher or Combination of relevant education experience and training.,10000
